<?xml version="1.0" encoding="UTF-8"?>
<!--DTD generated by XMLSPY v5 rel. 3 U (http://www.xmlspy.com)-->
<!--root element, represents a single article, possibly spanning multiple pages-->
<!ELEMENT article (header-item*, article-page+)>
<!--unit-href: A relative path to the containing unit's xml-->
<!--classification: The article classification-->
<!ATTLIST article
	unit-href CDATA #REQUIRED
	classification CDATA #IMPLIED
	xmlns CDATA #FIXED "http://www.iarchives.com/schema/2002/export"
>
<!--For a unit, these are all the articles contained in this unit.  For a page, these are all the articles which *begin* on the page.-->
<!ELEMENT articles (article-ref*)>
<!--This is the meta-data associated with the scope.  It might include date, edition, section,  page, article name, etc.-->
<!ELEMENT header-item (#PCDATA)>
<!--name: The type of data contained in the element (date, edition, section)-->
<!ATTLIST header-item
	name CDATA #REQUIRED
	value CDATA #IMPLIED
>
<!--A sequence of word nodes-->
<!ELEMENT nodes (n*)>
<!--A page the article appears on.-->
<!ELEMENT article-page (article-clipping+)>
<!--href: A relative path to the page xml file for this page of the article-->
<!ATTLIST article-page
	href CDATA #REQUIRED
>
<!--A reference to an article-->
<!ELEMENT article-ref EMPTY>
<!--href: A relative path to the xml describing this article-->
<!ATTLIST article-ref
	href CDATA #REQUIRED
>
<!--Node Element.  Represents one or more word options at a given location.  Element and attribute names are abbreviated to save space, since there will be many of these elements.-->
<!ELEMENT n (r*, o+)>
<!--i: the node's ID.  Note that these ID's are not global.  They are local to the enclosing nodes element.-->
<!--n: A comma-separated list of next-node IDs.  The OCR tries to order the words in reading order, and this is the way that is represented.  Multiple next-nodes occur when multiple OCR engines disagree on which word should follow.  -->
<!ATTLIST n
	i CDATA #REQUIRED
	n CDATA #IMPLIED
>
<!--Represents an image that contains a section of the article.  The coordinates refer to the the containing page's image.-->
<!ELEMENT article-clipping (article-element+)>
<!--image-file: specifies the relative location of the file containing the article clipping-->
<!--index: A zero-based index into the image file, if the image is a multi-page tif, for example.  -->
<!--l: The left coordinate-->
<!--t: The top coordinate-->
<!--r: The right coordinate-->
<!--b: The bottom coordinate-->
<!ATTLIST article-clipping
	image-file CDATA #REQUIRED
	index CDATA #IMPLIED
	l CDATA #REQUIRED
	t CDATA #REQUIRED
	r CDATA #REQUIRED
	b CDATA #REQUIRED
>
<!--Node rectangle.  Nodes may have more than one rectangle ( if the word is hyphenated, for example).  If the exported images is PDF only, word coordinates are not needed, and there will be no rectangle node.-->
<!ELEMENT r EMPTY>
<!--l: The left coordinate-->
<!--t: The top coordinate-->
<!--r: The right coordinate-->
<!--b: The bottom coordinate-->
<!ATTLIST r
	l CDATA #REQUIRED
	t CDATA #REQUIRED
	r CDATA #REQUIRED
	b CDATA #REQUIRED
>
<!--Word option element.  The text of this element is the word.-->
<!ELEMENT o (#PCDATA)>
<!--p: The pdf character offset
This is the character offset that marks the beginning of the word on the corresponding pdf page.  It facilitates pdf word highlighting, and corresponds to the "pos" attribute in the pdf Highlight Format's "loc" tag.-->
<!ATTLIST o
	p CDATA #IMPLIED
>
<!--An article element represents an even smaller section of the article, such as the headline, the byline or the body.-->
<!ELEMENT article-element (text?, zone*)>
<!--type: Specifies whether it is a headline, subheadline, byline, body, etc.-->
<!ATTLIST article-element
	type CDATA #REQUIRED
>
<!--The text of the article-element.  In most cases, this will simply be a concatenation of the zone-text from each zone.-->
<!ELEMENT text (#PCDATA)>
<!--A rectangular region in the article element.  The coordinates of this zone refer to the the article's image (the image specified in the article-clipping element).-->
<!ELEMENT zone (zone-text?, nodes?)>
<!--l: The left coordinate-->
<!--t: The top coordinate-->
<!--r: The right coordinate-->
<!--b: The bottom coordinate-->
<!ATTLIST zone
	l CDATA #REQUIRED
	t CDATA #REQUIRED
	r CDATA #REQUIRED
	b CDATA #REQUIRED
>
<!--The text contained in the particular zone.  Usually a substring of the article element's text element.-->
<!ELEMENT zone-text (#PCDATA)>
