<?xml version="1.0" encoding="UTF-8"?>
<!DOCTYPE article SYSTEM "article.dtd">
<article xmlns="http://www.iarchives.com/schema/2002/export" unit-href="../unit.xml" classification="unclassified"><header-item name="volume" value="1">I</header-item><header-item name="number" value="1">1</header-item><header-item name="date" value="675867">15-JUN-1850</header-item><header-item name="page" value="1">1</header-item><article-page href="../pages/p001_Va_071_D45_v01.xml"><article-clipping image-file="pdf/0.pdf" index="0" l="0" t="0" r="1407" b="390"><article-element type="article"><zone l="0" t="0" r="1407" b="240"><nodes><n i="Oc"><o p="0">D</o></n><n i="Od"><o p="1">S</o></n><n i="Oe"><o p="2">ERET</o></n><n i="Of"><o p="6">E</o></n><n i="Og"><o p="7">BY</o><o p="9">HY</o></n><n i="BS"><o p="11">W</o></n><n i="BT"><o p="12">RICHARDS</o></n><n i="BU"><o p="20">tx</o></n><n i="BV"><o p="22">S</o></n><n i="Oh"><o p="23">L</o></n><n i="BW"><o p="24">I</o><o p="25">1</o></n><n i="BX"><o p="26">CITY</o></n><n i="BY"><o p="30">DESERET</o></n><n i="BZ"><o p="37">1</o></n><n i="Ba"><o p="38">JUNE</o></n><n i="Bb"><o p="42">15</o></n><n i="Bc"><o p="44">ysae</o></n><n i="Bd"><o p="48">VOL</o></n><n i="Be"><o p="51">1</o></n><n i="Oi"><o p="52">NO</o></n><n i="Bf"><o p="54">0</o></n><n i="Bg"><o p="55">1</o></n></nodes></zone></article-element><article-element type="article"><zone l="0" t="239" r="454" b="390"><nodes><n i="Bh"><o p="56">LAT</o></n><n i="Bi"><o p="59">40</o></n><n i="Bj"><o p="61">45</o></n><n i="Bk"><o p="63">44</o></n><n i="Bl"><o p="65">LON</o></n><n i="S"><o p="68">I</o><o p="69">1</o></n><n i="Bm"><o p="70">ill</o><o p="73">iii</o></n><n i="T"><o p="76">I</o><o p="77">1</o></n><n i="U"><o p="78">1</o></n><n i="Bn"><o p="79">26</o><o p="81">06</o></n><n i="Bo"><o p="83">34</o></n><n i="Bp"><o p="85">prospectus</o></n><n i="Bq"><o p="95">DESERET</o></n><n i="Br"><o p="102">NEWS</o></n></nodes></zone></article-element></article-clipping></article-page></article>
