<?xml version="1.0" encoding="UTF-8"?>
<!DOCTYPE article SYSTEM "article.dtd">
<article xmlns="http://www.iarchives.com/schema/2002/export" unit-href="../unit.xml" classification="unclassified"><header-item name="volume" value="1">I</header-item><header-item name="number" value="1">1</header-item><header-item name="date" value="675867">15-JUN-1850</header-item><header-item name="page" value="4">4</header-item><article-page href="../pages/p004_Va_071_D45_v01.xml"><article-clipping image-file="pdf/6.pdf" index="0" l="0" t="909" r="498" b="1002"><article-element type="article"><zone l="0" t="0" r="498" b="93"><nodes><n i="C+"><o p="0">bield</o></n><n i="S3"><o p="5">1</o></n><n i="S4"><o p="6">E</o></n><n i="S5"><o p="7">ISE</o></n><n i="S6"><o p="10">R</o></n><n i="S7"><o p="11">ET</o></n><n i="Im"><o p="13">jlewis</o></n><n i="S8"><o p="19">A</o></n><n i="S9"><o p="20">E</o></n><n i="S+"><o p="21">W</o></n><n i="A"><o p="22">lyl</o><o p="25">III</o></n><n i="In"><o p="28">P</o></n><n i="Io"><o p="29">I</o><o p="30">1</o></n><n i="Ip"><o p="31">B</o></n><n i="Iq"><o p="32">LI</o></n><n i="Ir"><o p="34">S</o></n><n i="Is"><o p="35">H</o></n><n i="It"><o p="36">F</o></n><n i="Iu"><o p="37">T</o></n><n i="Iv"><o p="38">E</o></n><n i="Iw"><o p="39">V</o></n><n i="Ix"><o p="40">ERY</o><o p="43">erv</o></n><n i="Iz"><o p="46">fl</o></n><n i="TA"><o p="48">I</o><o p="49">1</o></n><n i="I0"><o p="50">R</o></n><n i="I1"><o p="51">D</o></n><n i="I2"><o p="52">A</o></n><n i="I3"><o p="53">Y</o></n></nodes></zone></article-element></article-clipping></article-page></article>
