<?xml version="1.0" encoding="UTF-8"?>
<!DOCTYPE article SYSTEM "article.dtd">
<article xmlns="http://www.iarchives.com/schema/2002/export" unit-href="../unit.xml" classification="advertising"><header-item name="volume" value="1">I</header-item><header-item name="number" value="1">1</header-item><header-item name="date" value="675867">15-JUN-1850</header-item><header-item name="page" value="4">4</header-item><article-page href="../pages/p004_Va_071_D45_v01.xml"><article-clipping image-file="pdf/8.pdf" index="0" l="0" t="1722" r="498" b="1962"><article-element type="article"><zone l="0" t="0" r="498" b="240"><nodes><n i="K0"><o p="0">1</o></n><n i="K1"><o p="1">wasted</o><o p="7">WAITED</o></n><n i="K2"><o p="13">at</o></n><n i="K3"><o p="15">our</o></n><n i="FW"><o p="18">office</o></n><n i="K4"><o p="24">oali</o></n><n i="K5"><o p="28">ce</o></n><n i="FX"><o p="30">gour</o><o p="34">hour</o></n><n i="FY"><o p="38">wheat</o></n><n i="FZ"><o p="43">V</o></n><n i="Fb"><o p="44">heat</o></n><n i="Fa"><o p="48">corn</o><o p="52">corll</o></n><n i="Fc"><o p="57">meal</o><o p="61">ineal</o></n><n i="Fd"><o p="66">butter</o></n><n i="Fe"><o p="72">cheese</o></n><n i="Ff"><o p="78">1</o></n><n i="Fg"><o p="79">low</o><o p="82">dow</o></n><n i="Fh"><o p="85">and</o></n><n i="Fi"><o p="88">pork</o></n><n i="Fj"><o p="92">in</o></n><n i="Fk"><o p="94">exchange</o></n><n i="Fl"><o p="102">for</o></n><n i="Fm"><o p="105">llie</o><o p="109">tile</o></n><n i="Fn"><o p="113">nas</o><o p="116">fas</o></n></nodes></zone></article-element></article-clipping><article-clipping image-file="pdf/8.pdf" index="1" l="497" t="0" r="926" b="730"><article-element type="article"><zone l="0" t="0" r="429" b="730"><nodes><n i="Tw"><o p="0">ja</o></n><n i="FS"><o p="2">I</o><o p="3">1</o></n><n i="K7"><o p="4">we</o></n><n i="K9"><o p="6">home</o><o p="10">homo</o></n><n i="K+"><o p="14">affairs</o></n><n i="K/"><o p="21">this</o></n><n i="LA"><o p="25">week</o></n><n i="LB"><o p="29">to</o></n><n i="CC"><o p="31">case</o><o p="35">ease</o></n><n i="Sl"><o p="39">tv</o></n><n i="LC"><o p="41">cave</o></n><n i="Sm"><o p="45">ve</o></n><n i="LD"><o p="47">ruc</o><o p="50">rul</o></n><n i="LE"><o p="53">in</o></n><n i="LF"><o p="55">i</o></n><n i="LG"><o p="56">i</o></n><n i="LH"><o p="57">foreign</o></n><n i="LJ"><o p="64">pk</o></n><n i="LL"><o p="66">etche</o></n><n i="LK"><o p="71">ot</o></n><n i="LM"><o p="73">which</o></n><n i="LN"><o p="78">vc</o><o p="80">we</o></n><n i="LO"><o p="82">cil</o><o p="85">cli</o></n><n i="LP"><o p="88">give</o></n><n i="LQ"><o p="92">but</o></n><n i="LR"><o p="95">few</o></n><n i="LS"><o p="98">fires</o></n><n i="LT"><o p="103">and</o></n><n i="C2"><o p="106">flo</o><o p="109">fio</o></n><n i="LU"><o p="112">lloyds</o><o p="118">flocia</o></n><n i="C3"><o p="124">cIs</o></n><n i="C4"><o p="127">murders</o></n><n i="C5"><o p="134">a</o></n><n i="C6"><o p="135">id</o></n><n i="So"><o p="137">rr</o></n><n i="C7"><o p="139">rol</o><o p="142">roi</o></n><n i="C8"><o p="145">berils</o></n><n i="LV"><o p="151">cholera</o></n><n i="LW"><o p="158">and</o></n><n i="LX"><o p="161">perplex</o></n><n i="LY"><o p="168">lcy</o><o p="171">icy</o></n><n i="LZ"><o p="174">of</o></n><n i="La"><o p="176">lotions</o></n><n i="Lb"><o p="183">are</o><o p="186">arc</o></n><n i="Lc"><o p="189">prevalent</o></n><n i="Le"><o p="198">con</o><o p="201">cou</o></n><n i="Lf"><o p="204">bernoi</o></n><n i="Sq"><o p="210">ZD</o></n><n i="Lh"><o p="212">which</o></n><n i="Li"><o p="217">we</o></n><n i="Lj"><o p="219">shall</o><o p="224">shail</o></n><n i="Lk"><o p="229">continue</o></n><n i="Ll"><o p="237">to</o></n><n i="Ln"><o p="239">sketch</o></n><n i="Lo"><o p="245">cli</o><o p="248">cil</o></n><n i="Lq"><o p="251">from</o></n><n i="Lr"><o p="255">the</o></n><n i="Ls"><o p="258">best</o></n><n i="Lt"><o p="262">information</o></n><n i="Lu"><o p="274">yet</o></n><n i="Lv"><o p="277">obtained</o></n><n i="Lw"><o p="285">it</o></n><n i="Lx"><o p="287">is</o></n><n i="Ly"><o p="289">believed</o></n><n i="Lz"><o p="297">that</o><o p="301">fluit</o></n><n i="L0"><o p="306">til</o><o p="309">tib</o></n><n i="L1"><o p="312">house</o></n><n i="L2"><o p="317">wa</o></n><n i="L3"><o p="319">i</o></n><n i="Bv"><o p="320">I</o><o p="321">1</o></n><n i="Bw"><o p="322">cu</o></n><n i="L4"><o p="324">ill</o><o p="327">iii</o></n><n i="C"><o p="330">uve</o><o p="333">the</o></n><n i="E"><o p="336">wee</o><o p="339">woe</o></n><n i="D"><o p="342">acks</o></n><n i="G"><o p="346">n</o></n><n i="I"><o p="347">s</o></n><n i="F"><o p="348">in</o><o p="350">ju</o></n><n i="H"><o p="352">cleetta</o></n><n i="J"><o p="359">a</o></n><n i="K"><o p="360">S</o></n><n i="L"><o p="361">ealier</o></n><n i="M"><o p="367">and</o><o p="370">aud</o></n><n i="N"><o p="373">clerk</o></n><n i="O"><o p="378">and</o></n><n i="P"><o p="381">their</o></n><n i="W"><o p="386">p</o></n><n i="Q"><o p="387">progress</o></n><n i="Y"><o p="395">n</o></n><n i="S"><o p="396">s</o></n><n i="R"><o p="397">since</o></n><n i="U"><o p="402">ice</o></n><n i="T"><o p="405">lias</o><o p="409">has</o></n><n i="V"><o p="412">well</o><o p="416">weil</o></n><n i="X"><o p="420">compared</o></n><n i="b"><o p="428">has</o></n><n i="d"><o p="431">again</o></n><n i="e"><o p="436">appeared</o></n><n i="f"><o p="444">m</o></n><n i="Ss"><o p="445">in</o></n><n i="g"><o p="447">the</o></n><n i="h"><o p="450">states</o><o p="456">stakes</o></n><n i="i"><o p="462">hungary</o></n><n i="j"><o p="469">has</o></n><n i="k"><o p="472">fallen</o></n><n i="m"><o p="478">n</o></n><n i="n"><o p="479">i</o></n><n i="o"><o p="480">en</o><o p="482">bit</o></n><n i="p"><o p="485">rope</o></n><n i="L5"><o p="489">and</o></n><n i="L6"><o p="492">tile</o><o p="496">che</o></n><n i="L7"><o p="499">present</o></n><n i="L9"><o p="506">is</o></n><n i="L+"><o p="508">like</o></n><n i="L/"><o p="512">a</o></n><n i="MA"><o p="513">calm</o></n><n i="MB"><o p="517">before</o></n><n i="MD"><o p="523">a</o></n><n i="ME"><o p="524">more</o></n><n i="MG"><o p="528">hereafter</o></n><n i="MH"><o p="537">rcy</o><o p="540">0</o></n><n i="MI"><o p="541">post</o></n><n i="MJ"><o p="545">africo</o></n><n i="ML"><o p="551">ope</o><o p="554">opet</o></n><n i="TV"><o p="558">fach</o></n><n i="Tr"><o p="562">tach</o></n><n i="MN"><o p="566">ch</o></n><n i="MM"><o p="568">sabbath</o></n><n i="MO"><o p="576">chwi</o></n><n i="St"><o p="580">om</o></n><n i="MP"><o p="582">12</o></n><n i="MQ"><o p="584">to</o></n><n i="MR"><o p="586">1</o></n><n i="FV"><o p="587">alel</o></n><n i="MT"><o p="591">P</o></n><n i="MU"><o p="592">BT</o></n></nodes></zone></article-element></article-clipping></article-page></article>
