<?xml version="1.0" encoding="UTF-8"?>
<!DOCTYPE article SYSTEM "article.dtd">
<article xmlns="http://www.iarchives.com/schema/2002/export" unit-href="../unit.xml" classification="article"><header-item name="volume" value="1">I</header-item><header-item name="number" value="1">1</header-item><header-item name="date" value="675867">15-JUN-1850</header-item><header-item name="page" value="8">8</header-item><header-item name="headline">Poetry</header-item><article-page href="../pages/p008_Va_071_D45_v01.xml"><article-clipping image-file="pdf/16.pdf" index="0" l="501" t="0" r="934" b="481"><article-element type="headline"><text>Poetry </text></article-element><article-element type="subheadline"><text>To My Friends in the Valley </text></article-element><article-element type="article"><zone l="0" t="0" r="433" b="481"><nodes><n i="Vm"><o p="0">tO</o></n><n i="Vn"><o p="2">ETRY</o></n><n i="Tb"><o p="6">to</o></n><n i="Tc"><o p="8">MY</o></n><n i="Tf"><o p="10">v</o></n><n i="Te"><o p="11">is</o><o p="13">vi</o></n><n i="Th"><o p="15">i</o></n><n i="Tg"><o p="16">ane</o></n><n i="Ti"><o p="19">VALLEY</o></n><n i="Tj"><o p="25">let</o></n><n i="Tk"><o p="28">all</o></n><n i="Tl"><o p="31">who</o></n><n i="Tm"><o p="34">would</o></n><n i="Tn"><o p="39">have</o></n><n i="To"><o p="43">a</o></n><n i="Tp"><o p="44">good</o></n><n i="Tq"><o p="48">paper</o></n><n i="Tr"><o p="53">their</o></n><n i="Ts"><o p="58">talents</o></n><n i="Tt"><o p="65">and</o></n><n i="Tu"><o p="68">time</o></n><n i="Tv"><o p="72">nee</o><o p="75">neer</o></n><n i="Tw"><o p="79">abuse</o></n><n i="Tx"><o p="84">since</o></n><n i="CQ"><o p="89">said</o><o p="93">sald</o></n><n i="Tz"><o p="97">maidby</o></n><n i="CR"><o p="103">by</o></n><n i="CS"><o p="105">the</o></n><n i="CT"><o p="108">wise</o></n><n i="T1"><o p="112">and</o></n><n i="T2"><o p="115">the</o></n><n i="T3"><o p="118">humor</o><o p="123">humored</o></n><n i="UC"><o p="130">cd</o></n><n i="T4"><o p="132">that</o></n><n i="T5"><o p="136">the</o></n><n i="T6"><o p="139">best</o></n><n i="T7"><o p="143">in</o></n><n i="T8"><o p="145">the</o></n><n i="T9"><o p="148">world</o></n><n i="T+"><o p="153">is</o></n><n i="T/"><o p="155">the</o></n><n i="UA"><o p="158">NEWS</o></n><n i="IB"><o p="162">then</o></n><n i="IC"><o p="166">ye</o></n><n i="ID"><o p="168">who</o></n><n i="IE"><o p="171">so</o></n><n i="IF"><o p="173">long</o></n><n i="IG"><o p="177">have</o></n><n i="IH"><o p="181">been</o></n><n i="II"><o p="185">thinking</o></n><n i="IJ"><o p="193">what</o></n><n i="IK"><o p="197">paper</o></n><n i="IL"><o p="202">this</o></n><n i="IM"><o p="206">year</o></n><n i="IN"><o p="210">you</o></n><n i="IO"><o p="213">will</o></n><n i="IP"><o p="217">choose</o></n><n i="IQ"><o p="223">come</o></n><n i="IR"><o p="227">trip</o></n><n i="IS"><o p="231">gaily</o></n><n i="IT"><o p="236">up</o></n><n i="IU"><o p="238">to</o></n><n i="IV"><o p="240">the</o></n><n i="IW"><o p="243">office</o></n><n i="IX"><o p="249">and</o></n><n i="IY"><o p="252">subscribe</o></n><n i="IZ"><o p="261">for</o></n><n i="Ia"><o p="264">the</o></n><n i="Ib"><o p="267">DESERET</o></n><n i="Ic"><o p="274">NEWS</o></n><n i="Id"><o p="278">and</o></n><n i="Ie"><o p="281">now</o></n><n i="If"><o p="284">dearest</o></n><n i="Ig"><o p="291">friends</o></n><n i="Ih"><o p="298">I</o><o p="299">1</o></n><n i="Ii"><o p="300">will</o></n><n i="Ij"><o p="304">leave</o><o p="309">leate</o></n><n i="Ik"><o p="314">you</o></n><n i="Il"><o p="317">this</o></n><n i="Im"><o p="321">counsel</o></n><n i="In"><o p="328">I</o><o p="329">1</o></n><n i="Io"><o p="330">pray</o></n><n i="Ip"><o p="334">you</o></n><n i="Iq"><o p="337">dont</o></n><n i="H"><o p="341">ose</o><o p="344">iose</o></n><n i="Is"><o p="348">the</o></n><n i="It"><o p="351">best</o></n><n i="Iu"><o p="355">of</o></n><n i="Iv"><o p="357">advice</o></n><n i="Iw"><o p="363">I</o><o p="364">1</o></n><n i="Ix"><o p="365">can</o></n><n i="Iy"><o p="368">give</o></n><n i="Iz"><o p="372">you</o></n><n i="BO"><o p="375">I</o><o p="376">1</o></n><n i="I0"><o p="377">Is</o></n><n i="I1"><o p="379">pay</o></n><n i="I2"><o p="382">in</o></n><n i="I3"><o p="384">advance</o></n><n i="I4"><o p="391">for</o></n><n i="I5"><o p="394">the</o><o p="397">thea</o></n><n i="Bj"><o p="401">sew</o></n><n i="I6"><o p="404">new</o></n><n i="I7"><o p="407">B</o></n></nodes></zone></article-element></article-clipping></article-page></article>
