<?xml version="1.0" encoding="UTF-8"?>
<!DOCTYPE article SYSTEM "article.dtd">
<article xmlns="http://www.iarchives.com/schema/2002/export" unit-href="../unit.xml" classification="article"><header-item name="volume" value="1">I</header-item><header-item name="number" value="1">1</header-item><header-item name="date" value="675867">15-JUN-1850</header-item><header-item name="page" value="4">4</header-item><header-item name="headline">Office of Delivery</header-item><article-page href="../pages/p004_Va_071_D45_v01.xml"><article-clipping image-file="pdf/7.pdf" index="0" l="0" t="1001" r="498" b="1724"><article-element type="headline"><text>Office of Delivery </text></article-element><article-element type="article"><zone l="0" t="0" r="498" b="723"><nodes><n i="C/"><o p="0">aj</o></n><n i="I4"><o p="2">OFFICE</o></n><n i="I5"><o p="8">or</o><o p="10">OF</o></n><n i="I7"><o p="12">the</o></n><n i="Su"><o p="15">J</o></n><n i="I8"><o p="16">news</o></n><n i="I9"><o p="20">will</o></n><n i="I+"><o p="24">bp</o><o p="26">be</o></n><n i="I/"><o p="28">delivered</o></n><n i="JA"><o p="37">at</o></n><n i="JB"><o p="39">the</o></n><n i="JC"><o p="42">post</o></n><n i="JD"><o p="46">offic</o></n><n i="JE"><o p="51">subscribers</o></n><n i="Fo"><o p="62">brorn</o></n><n i="JF"><o p="67">1</o></n><n i="JG"><o p="68">born</o></n><n i="JH"><o p="72">distant</o></n><n i="JI"><o p="79">parts</o></n><n i="JJ"><o p="84">of</o></n><n i="JK"><o p="86">the</o></n><n i="JL"><o p="89">valley</o></n><n i="JM"><o p="95">to</o></n><n i="JN"><o p="97">order</o></n><n i="JO"><o p="102">but</o><o p="105">hut</o></n><n i="JP"><o p="108">for</o></n><n i="JQ"><o p="111">their</o></n><n i="JR"><o p="116">convenience</o></n><n i="JS"><o p="127">we</o></n><n i="JT"><o p="129">propose</o></n><n i="JU"><o p="137">to</o></n><n i="JV"><o p="139">forward</o></n><n i="JW"><o p="146">packages</o></n><n i="JX"><o p="154">as</o></n><n i="JY"><o p="156">we</o></n><n i="JZ"><o p="158">may</o></n><n i="Ja"><o p="161">have</o></n><n i="Sv"><o p="165">tr</o></n><n i="Jb"><o p="167">opportunity</o></n><n i="Jc"><o p="178">to</o></n><n i="Sx"><o p="180">A</o></n><n i="Jd"><o p="181">ANSON</o></n><n i="Tn"><o p="186">sos</o></n><n i="Sy"><o p="189">sov</o></n><n i="Je"><o p="192">CALL</o></n><n i="Jf"><o p="196">north</o></n><n i="Jg"><o p="201">kanyon</o></n><n i="Jh"><o p="207">ward</o></n><n i="Ji"><o p="211">DANIEL</o></n><n i="Jj"><o p="217">millen</o><o p="223">MILLER</o></n><n i="Jk"><o p="229">north</o></n><n i="Jl"><o p="234">cottonwood</o></n><n i="Tc"><o p="245">W</o></n><n i="Ft"><o p="246">dad</o><o p="249">uld</o></n><n i="Jm"><o p="252">ISAAC</o></n><n i="Jn"><o p="257">CLARK</o></n><n i="Jo"><o p="262">brownsville</o></n><n i="Jp"><o p="273">Browns</o></n><n i="Jr"><o p="279">ville</o></n><n i="Jq"><o p="284">JOEL</o></n><n i="Js"><o p="288">JOHNSON</o></n><n i="Jt"><o p="295">mill</o></n><n i="Ju"><o p="299">creek</o></n><n i="Jv"><o p="304">WILLIAM</o><o p="312">WILLIAU</o></n><n i="Jw"><o p="320">CROSBY</o></n><n i="Jx"><o p="326">cottonwood</o></n><n i="Jy"><o p="336">ISAAC</o></n><n i="J0"><o p="341">Hi</o></n><n i="Jz"><o p="343">HIGBEE</o></n><n i="J2"><o p="349">GurE</o></n><n i="J1"><o p="353">utah</o></n><n i="J3"><o p="357">valley</o></n><n i="J4"><o p="363">PHINEAS</o></n><n i="J5"><o p="370">richards</o></n><n i="J6"><o p="378">san</o></n><n i="J7"><o p="381">pete</o></n><n i="J8"><o p="385">valley</o></n><n i="J9"><o p="391">EZRA</o></n><n i="J+"><o p="396">T</o></n><n i="J/"><o p="397">besson</o><o p="403">BENSON</o></n><n i="Sz"><o p="409">BE</o></n><n i="q"><o p="411">ason</o><o p="415">lson</o></n><n i="KA"><o p="419">tooele</o><o p="425">thoele</o></n><n i="KB"><o p="431">valley</o></n><n i="KC"><o p="437">and</o></n><n i="Te"><o p="440">rc</o></n><n i="KD"><o p="442">request</o></n><n i="Tf"><o p="449">kuest</o></n><n i="KE"><o p="454">them</o></n><n i="KF"><o p="458">to</o></n><n i="KG"><o p="460">act</o></n><n i="KH"><o p="463">as</o></n><n i="KI"><o p="465">our</o></n><n i="KJ"><o p="468">agents</o></n><n i="KK"><o p="474">subscribers</o></n><n i="S2"><o p="485">bers</o></n><n i="KL"><o p="489">will</o></n><n i="KM"><o p="493">do</o></n><n i="KN"><o p="495">well</o></n><n i="KO"><o p="499">to</o></n><n i="KP"><o p="501">inform</o></n><n i="KQ"><o p="507">us</o></n><n i="KR"><o p="509">or</o></n><n i="KS"><o p="511">the</o><o p="514">tiie</o></n><n i="KT"><o p="518">above</o></n><n i="KU"><o p="523">agent</o><o p="528">agents</o></n><n i="KV"><o p="534">s</o></n><n i="Tv"><o p="535">chere</o></n><n i="KX"><o p="540">they</o></n><n i="KY"><o p="544">will</o></n><n i="KZ"><o p="548">receive</o></n><n i="Ka"><o p="555">their</o></n><n i="Kb"><o p="560">papers</o></n><n i="Kc"><o p="566">city</o></n><n i="Kd"><o p="570">subscribers</o></n><n i="Ke"><o p="581">call</o><o p="585">can</o></n><n i="Kf"><o p="588">have</o></n><n i="Kg"><o p="592">their</o></n><n i="Kh"><o p="597">papers</o></n><n i="Ki"><o p="603">delivered</o></n><n i="Kj"><o p="612">for</o></n><n i="Kk"><o p="615">ail</o><o p="618">an</o></n><n i="Kl"><o p="620">additional</o></n><n i="Km"><o p="630">50</o></n><n i="Kn"><o p="632">cents</o></n><n i="Ko"><o p="637">for</o></n><n i="Kp"><o p="640">the</o></n><n i="Kq"><o p="643">term</o></n><n i="Kr"><o p="647">provided</o></n><n i="Ks"><o p="655">0</o></n><n i="Kt"><o p="656">ough</o></n><n i="Ku"><o p="660">wish</o></n><n i="Kv"><o p="664">it</o></n><n i="Kw"><o p="666">to</o></n><n i="Kx"><o p="668">employ</o></n><n i="Ky"><o p="674">a</o></n><n i="Kz"><o p="675">carrier</o></n></nodes></zone></article-element></article-clipping></article-page></article>
